question_name,answer_content,voteup_count,comment_count,created_time,updated_time
特朗普连任的可能性大不大?,6.6 更新：最近几天发生了好几件影响选情的大事，总体上看有两个不利于川普，一个利于川普。1 最近有多位重量级人物就暴乱发声，这似乎显示着共和党内可能正在尝试和川普保持距离。共和党党内大佬，前总统小布什虽然没有直接批评川普，但话里面的意思也是对川普的处置不满。当然，布什家族一直和川普不对付。川普的第一任国防部长，绰号疯狗的马蒂斯倒是直接站出来批评川普。马蒂斯虽然是个军人，不属于任何一党，但他指挥过海湾、伊拉克、阿富汗战争，战功赫赫，军队内威望极高，而现役和退伍老兵又一直是共和党的铁票仓。马蒂斯的这个举动非常有影响 ，搞得川普坐不住了，出来当面对骂。来自阿拉斯加的共和党参议员murkowski也批评了川普的政策，当然，还有早在弹劾时就跳反了的罗姆尼（就是2012年那个）也批评了川普。这对川普来说是一个非常不好的趋势。要知道选州长和议员时不少选民也仅仅是跟着党派投票，我支持川普，那我就给共和党的州长候选人投票，就这么简单。也就是说，川普这个名字对共和党的候选人是一个正资产。但问题在于，如果川普的评价持续走弱，这个名字就会变成负资产。而州长\参议员\众议员也有自己的职业生涯，他们的个人利益是要置于党派利益之上的，只有顺利连任才能谈个人利益。更何况川普顶多干个八年，而参议院不乏混了五六任在国会山一待就是三十年的老油条，他们是不可能把自己绑在战车上和川普一路冲到底的，毕竟自己还想在国会山多待几年呢。从各种方面来说，他们都比从政经验不过三年的川普要有经验的多。如果和川普联系在一起变成了负资产，那共和党内的很多人应该都会迅速止损，保持和川普的距离，以避免影响到自己的选举。一句话，对于大部分美国政治家来说，个人利益＞党派利益＞国家利益。而他们是无法容忍这种个人利益被川普所威胁到的。2 另一个坏消息是自家的福克斯新闻民调显示，川普在关键的摇摆州亚利桑那、俄亥俄和威斯康辛都不敌拜登，而这三个州2016年都归于川普。拜登在俄亥俄领先2个点，在亚利桑那领先4个点，在威斯康辛领先了9个点。我本来以为既然是福克斯的民调，某些川粉总不能还说是主流媒体故意抹黑天降伟人了。没想到真有极端川粉出来说福克斯也抛弃川皇了，和fake news同流合污。看来很多极端川粉已经形成逻辑闭环了：凡是有利川普的都是真消息，凡是不利川普的都是假新闻。[1]3 对于川普的一大好消息是周五股市暴涨。这是因为劳工部最新的数据显示目前美国失业率13.3%，远低于预估的19%左右，有两百五十万人重新找到了工作。当然，13.3%远远称不上是一个好看的数字。但美国股市就是进入了一种神必的阶段，尽管经济情况很烂，但只要好于预期股市就能自我高潮一波。还是那句话，只要经济基本面稳住，川普的连任问题不会很大。如果11月份美国经济能普遍回到疫情前水平，那川普会大有胜算。————————————————————————————————————知乎这个问题提了一年，有了将近一千篇回答。可惜的是中文互联网上对于美国政治的讨论其实大多比较复读机化和碎片化，我虽然肯定不是知乎上最懂美国政治的，但是应该算比较了解的。所以，我打算写一个总结性的答案预测下五个月后的美国总统大选，也顺便理清自己的思路。先说结论，站在今天（2020年6月2日）这个时间点来看，拜登胜选的可能性大于川普。2016到底发生了什么？要搞清楚2020年的情况，我们很有必要回顾四年前的那场大选到底发生了什么。有很多人说2016年是沉默的大多数的胜利，是没有被民调覆盖到的人的胜利，是农村包围城市的胜利。实际上，你现在回头看四年前的情况，会发现民调是相当准确的。首先我们要厘清这个背景知识，即美国总统大选不是普选制度，而是选举人团制度，是根据各州的人口比例分配选举人团。这也是为什么摇摆州才是至关重要的。2016年11月8日是投票日。我们翻看投票当天和前一两天的全国民调会发现，希拉里普遍领先1-3个点甚至打平。最后普选票的结果是希拉里领先川普280万票，只是因为特殊的选举人团制度才输掉了。全国民调统计的是全国的普选票情况，再考虑民调不可避免的统计误差，这些民调可以说非常准确。再比如说几个翻红帮助川普一锤定音的关键摇摆州。密歇根的民调希拉里领先4个点左右，最后特朗普仅仅以不到一万票的优势险胜。威斯康辛希拉里领先4-6个点左右，最后特朗普胜了不到两万票。可以说，考虑到所有民调都会有的统计误差，在民调显示选情相持不下的地方，特朗普都是以较小甚至微弱的优势拿下的多数选票。这表明民调本身并没有出太大的问题。[2]至于说川普是农村包围城市，这是正确的，但这是把普遍情况当做了特例。我这里放两张图，一张是2012年的选举结果，一张是2016年的，都是标到了县一级的情况，蓝色民主党（奥巴马、希拉里）红色共和党（罗姆尼、川普）。可以看出，这两张图除了东北部有些许改变，其他部分几乎能完美重合。其实第一张是16年的，第二张是12年的。这表明农村包围城市这种现象一直是存在的。大城市一直是民主党票仓，而农村和郊区一直是共和党票仓。造成这种现象的原因多种多样。比如说广袤的农村地区传统上是白人的聚居区，而倾向于民主党的少数族裔会因为工作机会前往大城市。大城市又本身就会吸纳来自国外的拉美裔亚裔移民，这些人都偏民主党。大城市因为高等教育和高等教育学历集中，容易扎堆偏左翼的人口。美国农村因为独特的社会风貌，农业人口会格外喜欢共和党的纲领，比如基督教，维护私有财产和持枪权。总而言之，川普在2016年的胜利只是小小的出乎意料，而不是爆了大冷门。2. 希拉里输在哪？所以到底为什么川普赢下了2016大选？a. 选票政治的一个特征是选民其实很注重外貌，比如台风、气质、谈吐、颜值。马克龙和里根都属于颜值过硬受到额外青睐的。希拉里本身形象不算好，自身黑历史又多，路人缘非常差。他的老公虽然是前总统但不光彩的履历反而是减分项。希拉里国务卿任内的班加西事件作为美国近代外交史上最大的屈辱之一更是被拿出来反复炒作。另一方面，特朗普虽然也谈不上形象多好，但是常年在真人秀和电影里混脸熟，路人缘算是不错。加上他本身性格大大咧咧，又是“小有成就”的商人，这在普通选民心中都是加分项。b. 另一点就是老生常谈的锈带衰落和工人的不满。这又牵扯到反移民、反政治正确的一股暗流。美国工业的衰落是一个持续困扰着美国的问题。川普虽然直接瞄准了这一问题，但在其任期内并没有解决问题，甚至很难说开始着手解决问题。不管是建墙还是修路还是制造业回流，三年过去了都没有看到什么成效。当然，这其实一方面是因为民主党在众议院的阻挠。但是川普的执政水平确实要打问号。3. 2020年会怎么样？如果你在三月份之前问我，我肯定会说川普连任概率大于拜登。但是三月份以来的疫情和暴乱几乎是组合拳打蒙了川普。首先我们要明确一点，一般的选举政治中大部分人都是中间派。这也很好理解，大部分普通人都不是天天关注政治的热心人士，而是随波逐流的人。这一部分人其实是最需要争取的。美国有40%的人是独立选民，[3]而实际上即使标榜自己是民主党或者共和党的人也并不都是硬核的参与者。a. 最近几个月对于川普一个非常糟糕的趋势是他正在逐渐失去中间派的支持。很明显，除了硬核川粉，是不会有人欣赏川普在死亡人数破十万的时候去打高尔夫、天天在推特打嘴仗、不断叫嚣要用军队解决抗议这些事情的。我甚至怀疑川普可能已经放弃了中间派，但他居然自信的以为仅凭自己的基本盘铁杆川粉就可以赢得大选。这肯定是远远不够的。今天的民调显示拜登在中间派里领先川普17个点，在两个月之前他仅仅领先1个点。[4]拜登最近在疯狂利用川普政府的应对失职给自己捞选票。比如说川普就是不愿意在镜头前戴口罩，拜登就要故意戴口罩，在一堆媒体前给大家拍，还把自己戴口罩的照片换成了Twitter头像。就是和川普对着干。b. 另一个趋势是老年选民正在逐渐倒向拜登。老年人虽然老，但其实是美国政治参与度最高的人群。一方面是因为退休没事干，另一方面是这代人就是所谓的boomer，战后婴儿潮一代，是伴随着反越战民权运动成长起来的一代人，参政议政是老习惯。民调显示，相比于2016年，这些老一代的选民们正在急速离开川普。川普在65+人群中的支持率比16年少了足足14个点。这可能一方面是因为川普糟糕的疫情处理让风险最高的老年人群更为不满。[5]c. 我之前预测过德州人口结构的变化（亚裔拉丁裔新移民的大量涌入）可能会让这个共和党最大票仓一劳永逸的变成蓝州，并且最快可能就在2020年发生。这可能要成真了。今年最震撼的一点是摇摆州出奇的多。北卡、乔治亚、德克萨斯、亚利桑那、威斯康辛、密歇根、宾夕法尼亚、佛罗里达今年都有摇摆的倾向。这几个州里面北卡、威斯康辛、密歇根、宾夕法尼亚、佛罗里达都在2008年倒向了奥巴马。而看这几个州最近的民调，可以说川普的选情非常不乐观。乔治亚的情况，这样一个传统的深红州就不应该成为摇摆州。亚利桑那看上去最有可能从传统深红州翻蓝。川普2016年胜选的关键佛罗里达、密歇根都在离他远去。就连德克萨斯都变成这样了。德克萨斯不断涌入的拉美裔似乎早晚要翻蓝这里。川普不管是建墙还是遣返都是在针对拉美裔，很难不让人产生怨气。事实上，在美国的拉美非法移民很多都有合法的美国公民亲戚，很多人只是因为等不及走移民程序（比如墨西哥人移民有长到爆炸的排期）。他们很多人会选择在最开始依靠这些合法亲戚的帮助立足脚跟。这些合法的拉美裔公民会是川普最需要统战的对象。拉美裔里除了古巴裔因为历史原因传统上反g，其他都可以说是民主党的基本盘。这几个摇摆州，拜登只要拿下3个以上，几乎胜选就是板上钉钉的了。d. 四千万失业，快两百万感染，十万人死亡，川普的这个答卷确实不太漂亮。许多专家都预测这次经济衰退会是另一个影响长达十年的大萧条。同时，现在又开始了席卷全美的暴乱，引燃了总是一点就炸的种族问题。当然，奥巴马也完全没有做到调和种族矛盾，但川普多多少少有racist的名声在外，这一下添油加醋肯定不是好事。尤其是疫情和暴乱都证明了川普似乎缺乏一个领袖应有的领导力。这些混乱不能全怪川普的头上。但是选民就是这样一种生物。在你的任期内出了问题，大家就只会想到怪罪你。所以说拜登能不能赢不取决于他自己够不够好，而取决于川普能有多坏。如果现任总统足够坏，即使竞争对手是条狗都能赢。d. 拜登有没有问题？问题大了去了。比如他疑似的老年痴呆症状，比如他同样槽点满满的黑历史，比如他辩论经常口齿不清。但是今年民主党的所有候选人可能真的没有一个选上去的概率高于拜登的了。这也是拜登一直标榜的自己electability。拜登的老白男属性只会得到党内激进派诟病，实际上永远是最为稳妥的选择。桑德斯太左加犹太人，大减分。彭博大土豪加犹太人，大减分。buttigieg同性恋，大减分。杨安泽华裔，大减分。amy没有亮眼的东西。唯一跟拜登一样的可能就只有出局过早的cory booker了。沃伦其实是不错的，而且属于没那么激进的激进派，现在当副总统的呼声很高。拜登嘛，虽然没什么出彩的，但是四平八稳，名义上经验丰富，还能让受够了川普的人想起奥巴马时代的good old days。4. 总结选举政治一个普遍规律是离选举日越近的事情对选民的影响越大。比如选民肯定会更考虑记忆犹新的昨天发生的事情，而不是川普第一年任期的事情。可以说，结尾在这么一个糟糕的2020是川普极大的不幸。但是现在离大选还有五个月，事情仍然有可能会发生巨大的转变。我们只能拭目以待了。番外：另一个很有趣的预测大选的数据是赔率，毕竟钱是不会说谎的。自暴乱开始以来拜登的赔率大跌，现在已经基本和川普的赔率持平。,3107,213,2020-06-02 16:40:18,2020-06-07 03:31:41
特朗普到底是真傻还是假傻？,特朗普不是傻，是他懂真的太多了。,206,34,2020-04-27 08:51:47,2020-04-27 08:51:47
如何看待特朗普公开指责鲍威尔并声称萨达姆没有大规模杀伤性武器？,,111,6,2020-06-08 01:05:01,2020-06-08 01:05:01
特朗普与拜登谁当选对中国最有利？,无条件支持特朗普，不支持川建国不是中国人。（滑稽）三叔侃侃：【爽文】中国阻挠特朗普连任美国总统？呸呸呸，我们坚决支持懂王再干500年！最近，美国总统特朗普的日子恐怕不太好过。美国的疫情人数已经遥遥领先于世界其他国家，并且完全没有平息的迹象。而美国国内反对者的声音同样此起彼伏，让民主党看到了年底胜选的希望。就在这样的情况下，今天我突然注意到特朗普的一番表态：他认为，是中国不想让自己赢得下一任大选，所以才用疫情的“卑鄙手法”搞破坏。看到特朗普这番表态，我不禁苦笑：胡说八道，我们明明坚定支持懂王再干500年！从未有美国的总统能给中国人带来快乐，然而特朗普做到了！作为一个今年30多岁的中国人，在我记忆之中留下印象的美国总统，大概就是克林顿、小布什、奥观海跟现在的特朗普了。不过在特朗普上台之前，其他的那些总统往往给人一种职业政客的印象。也就是说，无论他们笑起来多么有亲和力，好像随时可以与民同乐的样子……但从本质而言，这些总统都是高高在上，根本无法和普通人联系在一起的。他们就算来到中国，也往往是出席一些官方活动，发表一些听起来很心灵鸡汤的演讲。演讲稿或许会成为我们做阅读理解的材料，但不可能带给我们快乐。但是，特朗普不一样，他和历史上的任何总统都不一样。只要是每天关注新闻，我们都可以被他的言行举止逗乐，连抑郁症都能治好。他自称是“懂王”，没有什么是他不明白的，仿佛脑海当中装着一本百科全书。然而，吹牛皮又会分分钟惨遭打脸，看起来就像是个出尽洋相的丑角。未来有人能够将特朗普当总统期间的故事拍成电影的话，绝对是史上最佳喜剧片。试想，如果懂王不能够在年底大选中胜出，就意味着大家的生活从此要少了很多快乐。我们看到的，又会是一个整天端在那儿发鸡汤的新总统，特别不好玩。这样一来，中国人民的精神娱乐生活，岂不是将遭遇沉重打击？哪怕为了看懂王说段子，我们也要支持他继续干下去！他撕下了美国虚伪的面具，给了中国人民绝佳爱国教育！尽管美国可能是全世界最喜欢搞事的国家，200多年历史当中，死在美国人手里的亡魂无数。然而，当懂王上台之前，美国的形象在咱们国内基本上还是不折不扣的“人类灯塔”。只看那些媒体、公知的说法，美国简直就是人类发展的最终形态。美国蓝星最善良，美国永远站在弱者的一边，哪怕外星人打过来，也是美国带领全世界反抗…我记忆中的那些美国总统，也都一个个整天向大家灌输类似于上面那样的价值观。还别说，至少10年前的时候，你要在国内网络说一句美国虚伪，估计分分钟被几万人轮着骂。如果2016年上来的是希拉里，估计类似情况还会延续下去。那么，很多人还会被美国的假面具蒙在鼓里，真的以为美国会为了中国的未来而奋斗。所幸，他来了他来了，他带着“美国优先”上台了。什么同情弱者？什么国际主义？什么狗X的文明价值观？哪里有我美国重新伟大重要？上台这几年，懂王又是宣布退出各种国际组织，又是拼命找老盟友压榨军费。整个就是把美国朝着“人类公敌”的位置上摆。这下子，很多曾经被鸡汤迷晕的中国人，彻底清醒过来了。看看懂王的言行举止，谁还能相信美国真的那么善良？为了阻止公知在他上台之后继续猖狂，懂王甚至于公开宣布“停发工资”。更不用说这次疫情，懂王带领美国给予了国内公知致命的打击。那些疫情前期阴阳怪气，将中国面对未知病毒猝不及防而造成的种种不足，统统归咎于“没有学习美国和西方价值观”的人……现在一个个都哑火了。公知们绞尽脑汁编出来的煽情段子，现如今反而更加适合形容美国，你说尴不尴尬？中国人民由此更加自信，发现美国这种发达国家嘴上说得好听，其实完全不顾国民生命，什么“一车车拉尸体”的公知段子，到了美国居然就是现实。说是让美国重新伟大，好像反而变成了人间地狱……？这一切，都是懂王给我们带来的成绩，是他放纵了疫情蔓延，造就如今局面。这样的机会，千载难逢啊！特朗普和中国公开进行贸易对决，看起来很凶，其实大大有利于我们！当前几年贸易摩擦开始时，有些人冷嘲热讽，说我们最近几年太高调了，引发美国警惕。但他们没有想到的是，中国的快速发展根本就是肉眼可见，你再藏也藏不住。美国想要对中国动刀子，那是必然的事情。很多人觉得气愤，特朗普怎么可以如此之恨，悍然提升关税，让国内很多人丢了饭碗。但其实，如果上台的是其他总统，也许我们会更加吃力。还记得在国内拥有不少粉丝的奥观海吗？他曾经主导了一个名为TPP（全面与进步跨太平洋伙伴关系协定）的计划。看起来好像是要拉着小伙伴们一起继续开开心心做贸易，实际上却是构建封锁中国的包围网。如果后来当总统的是希拉里，必然将延续TPP政策。那么，我们的处境会更加糟糕。毕竟那将是发达国家联合起来，对中国进行施压。而且表面上还装作是自由贸易，公平公正的模样，让你想要反驳都不知道从何说起。然后，我们伟大的川皇刚就任，马不停蹄地退出TPP！你造吗，当这个消息出来时，那些美国的小伙伴都傻眼了！尤其是懂王打着美国优先的旗号，不光是针对中国进行贸易对决，还同时对欧盟、日本下手。奥巴马精心打造多年的中国经济包围网，现在变成了啥？美国一己之力单挑全世界！这几年，曾经是TPP成员的那帮国家，非但跟美国离心离德，还跑来和中国眉来眼去。你看意大利多么机灵，不愧是世界大战总能笑到最后的国家。不是懂王的话，我们中国人的日子肯定更加难过。既然如此，我们又有什么理由不支持他继续让美国变得“伟大”呢？（笑）积极推动反智主义，让美国变得越来越“愚蠢”多年来，美国给人的印象除了军事、经济实力强大之外，拥有顶尖科研能力、无数全球知名学府，也是让不少“华人”心甘情愿投奔美利坚的原因。历届总统不管出身如何，都公开表现出对知识的尊重，频频出现在高等学府的晚宴上。至于懂王嘛……大名鼎鼎的“注射消毒液治疗新冠理论”，大家都晓得伐？另外，懂王还有过“新冠就是大号的流感”“完全不影响上班”“在家呆着就能好”等神论。还别说，如果不是他的连番忽悠，美国人何止沦落到今天这番地步！而被懂王的“反智光环”迷惑的美国民众，更是开始纷纷上街闹事，打倒“科学的声音”。例如，要求抓捕比尔盖茨，这个从疫情刚开始就一直警告美国，并且从未判断失误的名人。再加上什么“威胁炒掉医学专家”等举动，更是将美国的反智主义浪潮推向了极致。这一切，特朗普居功至伟。如果能继续连任，就意味着反智主义会在美国进一步扩张，让越来越多民众变得很傻很天真。岂不美哉？懂王，加油！只有特朗普，才能让美国社会割裂到前所未有的地步之前网上有人吐槽说：最近这几个月，我们看到了美国历史上百年都很少遇到的情况。比如，股市大熔断，懂王天天坐火箭环绕太阳系。比如，接近3000万的失业人口。比如，因为疫情而几乎失去大半战斗力的美军。比如，得不到治疗而死，尸体被扔在一旁腐烂的美国民众……再想想，懂王上台之前，公知是怎么吹嘘美国的来着？瞧一瞧看一看，又是多么完美的爱国教育啊！再加上，这次疫情导致了美国死亡人口往往来自于黑人/拉美人/穷人/老人……本应该被鸡汤所保护的弱势群体，一个个倒下，一个个家破人亡。而特朗普又在那儿带节奏，说什么中国要负责。结果亚裔群体风声鹤唳，时时刻刻担心遭到其他美国人的报复。这么一来，可能很多原本就打算留在美国，为了美利坚灯塔效力的“同胞”觉醒了。尤其对比国内的疫情处理，民族的强大凝聚力，让他们再也不会产生投奔美国的念头。不光是海外华人，就连日本人、韩国人、东南亚人……一切的亚裔人群，都要重新考虑人生。美国社会自从马丁路德金的《我有一个梦想》之后，何曾割裂到如此地步？这都是懂王的功劳啊！在特朗普上台之前，曾经有人对2016年总统大选候选人进行了点评：现在看起来，居然是一场神预言……那么，就让他继续下去，见证美国的衰亡吧！当然了，如果想要支持懂王连任，光是在大洋彼岸打嘴炮可不行。我们中国人从来是讲究实用主义的，也只有某些人才会整天把鸡汤当成真理。那么，当懂王误会了中国的好朋友在“阻止他继续干下去”时，我们自然需要用实际行动告诉他：请再干500年，MAGA！新的一些创作，感谢支持~三叔侃侃：【舆论战】火烧白宫抓总统！把美国疫情风波改成游戏，让特朗普都想玩？三叔侃侃：【爽文】别不好意思承认啦：中国人的命，就是比美国的值钱！三叔侃侃：【娱乐】一心为中国！特朗普开撕推特，向世人揭露西方舆论的虚伪面纱三叔侃侃：【思考】消除对“外国人”的过度崇拜，或许可以从广告里少用外国演员开始……三叔侃侃：【警告】历史正在被篡改：美国是抗疫主力，中国成为了制造病毒的大BOSS？,7209,418,2020-04-30 20:37:02,2020-06-02 09:49:01
