question_name,answer_content,voteup_count,comment_count,created_time,updated_time
5月4日，美国新冠肺炎确诊病例超过115万？特朗普还行吗？,想弄清楚特朗普支持率升高，就需要弄明白特朗普的支持者都是什么人，有多少人。只有弄明白这个问题才能理解为什么特朗普一通傻比操作还那么多人支持。请看：先知带领大家驱散病毒https://www.zhihu.com/video/1234447369464688640请记住，这不是娱乐搞笑，也不是讽刺，这是影响力很广的——实打实的正经宗教活动。这位老兄名为肯尼斯科普兰，前几天他说耶稣大爷给他一个任务，让他来人间消灭新冠病毒，并且可以通过观看他的电视节目驱散新冠，方法是按他的方法大口吹气。。。用wind of god（上帝之风）。。。吹散病毒。。。。尼玛现场做法事的一群憨憨跟着他一起吹气，这不是吹散病毒，这是标准的传播病毒。。。这位大仙有私人飞机，防弹轿车，钱多的金山银海。明显就是一个神棍诈骗犯，应该被政法委反邪教办的铁拳打成肉泥那种。但是他可是川普的座上宾和好朋友，前几天川普还专程请他到白宫共进晚餐。为啥川普请这么一个神棍吃饭，因为他在南方有很大影响力，很多南部朴实的美国人民视他为先知。。。这些人同时也是川普的铁杆支持者。为什么美国这么分裂，因为美国放任自流的公立教育下限实在太低了，而精英所受的教育又是世界顶级。两拨人谁都看对方是傻比，精英看许多普通人是智商上的傻比，普通人看精英是道德上的撒旦。而普通人很多而且分布的州更广，这是川普这种人能当选还能为所欲为的前提。整个飞跃州都有大量川普拥趸。（东西海岸之间的州）而在南方最保守的”圣徒州”，高中毕业率只有50％，许多中学严禁教学生进化论等“歪理邪说”，教学生的都是亚当夏娃创世纪。。。宗教氛围浓厚，许多人高中毕业就去镇上打工或继续在农场当牛仔，谨遵教义、为人纯朴憨憨吃苦耐劳、不逃税也不逃避兵役，十分爱国爱家，甚至可以说道德高尚（《纸牌屋》下木语），娶一个中学同学然后生一大堆孩子，这种“老美国人”很多，他们最美国、最爱国、最勤劳、最老实却长期被当成空气，被当成傻比乡巴佬，川普一上台在经济上搞制造业回流，让这帮除了一膀子力气一无所有的人找到了希望；在政治上猛怼政治正确，用的什么彭斯之流都是保守到有谩骂同性恋纪录的，又使这帮不敢吭声的老实人找到了知音，这帮透明人八辈子可算找到自己人了，就算川普犯了错误，也百分之百信任川普，因为他们自父辈就把美国东西海岸视为堕落之地，并且为自己的圣徒精神骄傲。这种人广泛分布，科学素养极其匮乏，只看FOX等保守电台，他们不会因为川普的骚操作就不支持他，反而认为纽约、加州的无耻中政客对川普的支援忘恩负义，在欺负川普（尤其只看fox的话）。这些人基本盘就很可怕，疫情一来，更加急迫的支持川普，生怕东西海岸人面兽心的建制派政客害了美国（当然也和建制派长期无视他们，总干些蝇营狗苟的勾当有关，可搜爱泼斯坦），加上东西海岸一部分觉得要顾全大局的人，造成川普支持率短暂升高，现在又下来了。感谢无神论教育，真的。感恩感谢。,680,112,2020-04-17 12:04:36,2020-04-22 12:57:37
如何看待美国多州州长拒绝特朗普想派军队的决定？,在州长立场上没毛病，州长基本不可能支持总统派兵镇压自己洲民众，这对自己政治生涯可是毁灭性打击，所以即使是强硬派州长，也是自己解决，不需要特朗普介入。而温和派，主要是蓝州，他们也不是没镇压的能力，只是不想镇压罢了。只要黑人愿意和平游行，时间越久，大选中种族议题就越会占主导，到时候就按肤色投，候选人的能力反而其次，拜登也可能赢特朗普了。这不，老妖婆都亲自下场游行了，80岁了为了党争还去游行可真不容易（等一个被橡皮子弹带走再说了，谁知道特朗普要干啥啊，特朗普现在部署的有82空降师，第10山地师，第1步兵师。82空降师可以理解，毕竟练了20年的全球快速部署（虽然最后部署在了自己的首都）；可是第1步兵师是机械化步兵师，有“战斗第一”的称号，是精锐中的精锐，这五个师加起来可以碾碎中俄以外的任何一个国家，真的是去镇压的么？倒像是去打国民警卫队的。别搞一手假道灭虢，顺利的话直接接管州政府肃清反对派，不顺利也是国民自卫队和联邦军队直接中门对狙，内战一起特朗普自动连任。特朗普：我要焚烧这个世界，然后统治它的灰烬！懂王最终还是没有忘记当年的约定：“你负责干掉苏联，我负责干掉美国，一言为定！”,473,39,2020-06-03 19:35:47,2020-06-04 13:09:16
如何看待网传义乌再获大量特朗普竞选商品订单，特朗普会连任美国总统吗？,这个微博博主的分析可能存在滞后。我查到这个分析是在2020年4月29日作出的。但我能找到的义乌对美国选举预测的新闻来自于2019年12月。在这个新闻中，义乌生产商根据全球两大电商平台来自美国方面的应援产品订单，认为特朗普连任的可能很大。这和题主的截图内容具有一致性。但这个新闻是疫情大爆发前的新闻，这对现在的形式是没有指导意义的。我找到的最新的相关新闻来自3月25日，是一个义乌外贸商人担心特朗普连任不了，之前生产的产品砸在手上。所以至少在3月25日前，义乌外贸商也看不清未来的大选形式。同时，根据2020年3月新闻，美国多地大型集会取消，所以短期内基本不会再有新增的竞选旗帜订单，这给义乌指数的预测造成了障碍。综合我目前找到的情报，此次义乌指数暂时无法起到预测作用，因此无法确认特朗普能否连任。（如果有我没找到的新闻可以留言告诉我）但你问我支不支持特朗普连任，我是支持的，毕竟是人类懂王，由他带领美利坚，我很放心。,35,2,2020-05-02 08:43:00,2020-05-07 23:21:17
为什么美国的大学生大多不喜欢特朗普？,"小孩子未经历社会的毒打，脑子里就太多不切实际的东西。知识分子，也有一定的弱点。对社会其他群体了解少。概念太多，形而上学的东西太多。特朗普在宣布参加大选的时候，说&#34;some one said that im not a nice guy.&#34;（有人说我不是好东西）观众席有个声音格外嘹亮的大哥，突然像打雷一样高声大喊“take our job back, ! we dont need nice guy！”（把我们的工作抢回来！我们不需要老好人！）特朗普笑了一下说“emm ,we need the jobs. i am a nice guy, but we dont need words without action.”（嗯，我觉得我还不错，但是我们最重要的是把工作拿回来，不能只说不做）就是其实特朗普看来自己是不是个“道德帝”，根本无所谓。美国人民也不需要道德君子，吃喝拉撒才重要。你看，成年人就很面对实际：我们不需要一个天天说话好听的道德君子，我们需要工作需要公司需要钱。但是学生和知识分子，往往需要nice guy。毛主席说学生天生就是左派。就是学生们总是比任何社会的现实，都偏重于激进一方。但是这种激进在未经历人生历练的时候往往是极左。而只有那些经历了考验，最终还觉得社会需要继续被推进的中老年人，才会成为真正的社会进步力量和中坚力量。",213,50,2020-06-05 16:56:00,2020-06-05 17:16:34
如何看待奥巴马批评特朗普？,没有“奥巴马门”？特朗普喉舌立刻补上在奥巴马在语音会议上批评特朗普的新闻爆出来后，特朗普以史无前例的母亲节单日转发+原创126条推特的火力攻击奥巴马。作为“带节奏”专业博士毕业的特朗普，非常善于吸引人眼球，只用一个词就成功转移了大家的注意力，让大家忘了本来是批评他抗疫不利的主题，把战线烧到了奥巴马的半场。这个词就是“obamagate”，奥巴马门。奥巴马门，相比之下水门事件简直是小儿科特朗普一提出这个口号，一天时间就在推特上产生了两百多万条相关内容，他的支持者纷纷谴责、攻击奥巴马。《华盛顿邮报》的记者在记者会上提问特朗普，您老这个“奥巴马门”到底是个啥，能讲明白不？特朗普却根本说不出来：特朗普在白宫玫瑰园举行的新闻发布会上告诉《华盛顿邮报》记者菲尔·拉克，“你知道罪行是什么，罪行是大家都很清楚的。你所要做的就是读报，除了你的。”我人傻了……那这个奥巴马门到底是个啥，总不能真的就是凭空造词吧？其实还真有一套套理论，而且是在保守派网站上流传了一年多的阴谋论：前总统奥巴马及其政府官员，在特朗普任职初期，陷害了特朗普高级官员迈克尔弗林，使得他身陷“通俄门”调查，借此打击特朗普。直接看堪称特朗普喉舌的保守派媒体旗手——福克斯新闻的报道：律师声称奥巴马总统计划“陷害”弗林前国家安全顾问迈克尔·弗林的首席律师——鲍威尔，指责高级官员策划陷害弗林，并坚持认为前总统巴拉克·奥巴马本人参与其中。有证据表明联邦调查局特工对弗林采取了随便的方法，而不是告诉他，这是正式的调查他，也没有警告他在谈话过程中撒谎将构成联邦罪行。鲍威尔说：“因此，他们故意让他放松和不受保护，这是他们为陷害他所做的努力的一部分。”解密文件显示，奥巴马知道被窃听的弗林电话的细节根据周四公布的撤销弗林质控的文件显示，时任国家安全顾问的迈克尔·弗林的与时任俄罗斯大使谢尔盖·基斯利亚克在2016年12月进行了手机通话，而奥巴马完全知道这些通话的细节。奥巴马对弗林通话细节非常了解，当时联邦调查局承认这并不是犯罪，甚至不算不当行为。根据新解密的文件，2017年1月5日，时任联邦调查局局长詹姆斯科米，副总统拜登，中央情报局局长布伦南都出席了与奥巴马在椭圆形办公室的会议，他们正在与国家安全顾问赖斯和国家安全委员会其他成员一起讨论俄罗斯对于美国大选的干预。简报后，奥巴马要求科米等人“留在后面”，并说他“已经了解了有关弗林的信息”，以及他与俄罗斯大使的对话。奥巴马“明确表示，他不希望在此事上有任何其他信息，正在考虑白宫是否应根据已知信息对弗林进行区别对待。”弗林的律师鲍威尔说：“整个事情是在联邦调查局内部精心策划和建立的，前国家情报局局长、中情局局长约翰·布伦南都出现在那次会议上。”当被问及她是否相信弗林是整个阴谋的受害者时，鲍威尔说：“绝对。”,871,54,2020-05-15 00:11:41,2020-05-15 00:11:41
如何看待特朗普向韩国求援？,儿阿，帮爹去中国买，我拉不下老脸。,138,8,2020-03-25 08:45:10,2020-03-25 08:45:10
如何评价特朗普发明的“懂学”？,谢邀。前两天看了复旦大学沈逸老师的一个视频，其中有一个理论我觉得蛮有意思，可以分享一下。沈逸说，过去美国的选举是一种均衡战略。因为过去美国社会的结构是一个向上的抛物线，高处是数量最多的中产阶级，所以美国的两党在竞选策略上会尽量争取这部分人的支持，这是他们的基本盘。然后再通过争取一些摇摆势力来决定胜负。但是，过去几年，随着美国贫富分化的加剧，美国的社会结构开始向下凹陷。也就是说，更富裕和更贫穷的人越来越多，中产反而不再是两党的基本盘。这样，懂王争取的是变穷的那一部分人的支持，而希拉里争取的是另一部分人。所以，二者的竞选纲领才会出现如此大的区别。很显然，在美国的选举制度下，穷人与富人每一张选举票的效力是等同的。所以特朗普争取的这部分人虽然穷一些，但却有能力把他送上总统的宝座。而特朗普的“懂学”，可以说是面向这些选民的“术语”。要知道，特朗普的基本盘无论在收入、受教育程度等方面都远逊于民主党的基本盘。这个人群的一大特点是容易迷信权威——这个“权威”的意思是他们认为的“牛人”，这个牛人可以是各方面的牛人，哪怕是电视上的明星、主持人他们也认为是牛人。而知乎上许多人对于明星可能会喜欢，但却不会沦落到崇拜的地步。如果不太好理解“懂王”的诞生，那你可以把背景移植到中国。我们先虚构一个场景，假设在某个平行宇宙的中国，国内实行了全民普选领导人的制度。在这个背景下，有两个人进入了最后的竞选，其中一个是马云，另一个是前国务院副总理张三。按道理说，张三作为国务院副总理，对国家治理更为熟悉，是个更合适的人物。但是，张三很少在媒体上露面，选民知道他的人并不多。反而是马云，隔三差五上电视、出现在各种网络媒体上，几乎所有人都知道这是一个牛人，网上还传播着他的各种语录，民间对他还非常崇拜。（至少是十年前很多创业者言必称马云）。虽然我乎对996调侃不断，但奈何人数加起来也不过几千万。马云只要利用好这种崇拜，并且为自己树立一个无所不知的形象，那么马云就很有可能战胜张三而当选。有人说，互联网都这么发达了，怎么还有人信特朗普的胡说呢？你爸妈用微信，不还是隔三差五转发各种不靠谱的养生文章？设想一下，如果几个月前马云频繁在电视上公开说“XX药可以治疗新冠肺炎”、“新冠肺炎就是大号流感”、“新冠肺炎是XX的阴谋”等等，你爸妈、你的亲戚以及你那些初中辍学就去打工了的同学们会不会相信马云？换个问题，如果有两个视频摆在他面前，一个是一个不知道哪个医院的医生说“疫情很严重”，另一个视频是马云说“疫情不严重”，你觉得有多少人会相信医生？最有意思的一点是，自从新冠疫情发生以来，特朗普开发布会的频率和时间都大大增加了。统计数据显示，3月中旬以来，白宫发布会平均时长从61分钟增至105分钟，特朗普的平均发言时间也从20分钟延长到了53分钟。这种高曝光，也是特朗普增强在选民心中形象的一种方式。其实民粹真的很容易挑动。比如前几天杨坤diss《惊雷》这件事，如果发生在美国，川皇完全可以给杨坤贴一个装X犯的标签。有一点《惊雷》的作者说的没错，那就是听过《惊雷》的人的确比听过杨坤的歌的人多。只要川皇能站在《惊雷》听众的立场上一起diss杨坤，那么川皇能拿到的选票是相当多的。我在美国的一位朋友跟我说，自从疫情在美国爆发之后，身边支持特朗普的底层人也多了起来。她是传播学博士，对美国的这个情况还是有调查的。所以她说，看样子大概率今年特朗普还会当选。从另一个方面来说，很多人应该也会发现，在传播信息这方面，对于受教育程度不同的群体，策略也是不一致的。比如说，对于博士、硕士进行传播的时候切忌装X，老老实实讲就可以，最好谦逊一点。我们去开会的时候，就算是学术界的巨佬，也都会客气的说“我这只是自己的想法，请各位专家批评指正”。要是他敢说“没有人比我更懂XXX”，保证一堆博士回去翻文献打你脸。但是，对于那些受教育程度较低的群体，就一定要立起专业的范儿，牛皮吹大了也不怕露馅。各路假药广告、保健品厂商，都是这么一个路数。他们一定得是“没人比我更懂”，才会让消费者相信买他们的药是对的。如果他们也跟学者一样，说“这是我自己的一个想法，不一定对。欢迎大家提出意见，我们一起交流探讨”，你觉得那些人还会买他卖的东西吗？所以，他们在讲这个东西的时候，必须不容置疑——我就是最顶级的专家，全世界只有我最懂。惟其如此，他们的目标消费者才会相信他们。川皇这正是这样的“懂王”。总之，川皇只要能占据媒体更多的时间，并且“懂王”的立场愈发坚定，那么川皇的支持者也会越来越多。,2125,113,2020-05-22 03:35:31,2020-05-24 12:42:26
