question_name,answer_content,voteup_count,comment_count,created_time,updated_time
为什么特朗普那么坚持连任？,因为特朗普的愿景是让美国重新伟大，而四年的任期根本无法完成他的愿景，要相信特朗普是因为要实现他的愿景才出来选总统的。特朗普想让美国回到里根时代，让美国摆脱奥巴马时期急剧左转的状态。最重要的是让制造业回流到美国。因为奥巴马时期政策就是拉拢美国精英也是全球化既得利益者，牺牲中产阶级，发钱养着最底层的选票，让更多的非法移民进来扩大选民数量。特朗普上台前许下的政治誓言大部分都兑现了，但是制造业回流成果不佳。辛辛苦苦让富士康在美国设厂，全被利益集团弄得雷声大雨点小，最终建厂敷衍了事。我猜测特朗普下个任期的核心理念就是抛弃全球化，让制造业回流美国。全球化的浪潮让美国精英大赚特赚，却让美国的中产阶级过得越来做差，中产阶级数量极速萎缩，中产阶级的生活比二十年前差很多。全美怨气很重，但是政治正确当道，所有媒体都被精英控制，声音发不出来，怨气无处发泄。奥巴马当政时期严重的枪击案频发就是怨气无处发泄的结果，特朗普也是被这群人抬进白宫的。明显可以感觉到特朗普的四年比奥巴马时期严重的枪击案少了很多。台积电把最新的最先进的5纳米工厂放在美国估计是预判了美国的政治方向的措施。毕竟让制造业回流最好的办法就是立法加关税设置贸易壁垒。特朗普是商人，肯定无法忍受自己控制的企业(美国)一直处于亏损状态(贸易逆差)，而扭亏为盈的唯一办法就是逆全球化，而逆全球化是与大势抗衡，要与国内强大的既得利益集团抗衡，这也是为什么美国媒体精英非常排斥特朗普的原因。当然特朗普的策略就是与精英为敌，拉拢中低层在全球化热潮中失势的群体。特朗普所表现的总总行为都是在巩固和扩大自己的基本盘，只有基本盘足够稳固，下个任期得到两院多数才能立法，实现逆全球化，壮大美国的中产阶级。美国贸易逆差最大的国家就是中国，只有与中国对抗才能解决贸易逆差问题，所以才有了贸易战。这次疫情特朗普火力全开对准中国终极目的也是制造业回流。而且可悲的是因为这次疫情很可能让特朗普的制造业回流的梦想成真。因为美国人通过这次疫情发现，关键时刻任何国家包括盟友都不可靠，只有工厂建立在自己国家才行。所以今年的大选非常关键，代表了美国以后的道路是左转(全球化)还是右转(逆全球化)。在此立帖为证，特朗普会以超过上次的选票大幅度领先再次当选美国总统,13,42,2020-05-17 22:08:06,2020-05-17 23:49:16
特朗普会成为美国的戈尔巴乔夫吗？,戈氏是教科书式的投降派，他所做的一切都是为了投降。这种基因在盎格鲁萨克逊海盗民族的传统里就是几乎不存在的。以色列王更可能成为丘吉尔。既然诸位都知道知道，在二战开启的瞬间，布尔战争打空了国库，财政破裂的大英帝国就是注定要死了，那么为什么不毫赌一把，赢了向死而生，输了以强亡呢。丘吉尔这个人，想在内河用航母。但凡是懂一点战争常识的都知道，十有八九是要再把计划、希望和努力沉没一回 —— 但万一赌赢了呢？须知大和都不敢A上去的㍼，比起帝国远东舰队的豪赌，和紫石英号那种裤衩都输光了还要捂着杯子继续赌的风采，简直是像俾斯麦一样的“理智”。——短时间极致的理智和聪明，却彻底把未来断送了。——————————————————————————————————————————澡盆封锁剧本序幕已经开始。,592,66,2020-03-12 00:21:39,2020-03-19 22:35:29
中国媒体为什么每天黑特朗普？,据我所知，媒体总是喜欢“大事件”，越轰动越好，这是他们的职业天性。所以，如果你稍微有些与众不同，或者令人难以容忍，做事情十分大胆或饱受争议，媒体都会关注到你。我做的事情通常都有点与众不同，不怕非议，而且很有野心。另外，我年轻有为，做事风格又始终如一，因此，媒体经常捕捉我的消息。......这倒不是说我很讨媒体的喜欢。有时他们从正面报道我，有时相反。单纯从生意角度讲，能经常上报是利大于弊的。道理很简单，比方说，我在《纽约时报》用一个版面为新项目做广告，可能要花费4万美元，还不能保证公众对这则广告的认可度。但是，如果《纽约时报》用即使不太正面的语言写了一篇关于我生意的报道，不仅不用我花费一分钱，还有可能给我带来远大于4万美元的宣传效果。——《特朗普自传》疫情期间，特朗普几乎天天登上微博热搜，要么是因为奇怪的言论，要么是对中国的抹黑。微博有人调侃他是顶级流量。调侃归调侃，不得不佩服，这是人家在营销中练就的手段。网友们谈论特朗普的频率比谈论自己老大的频率都高，占据世人的眼球，这就是他的目的。连有堵墙的中国人民都时时刻刻关注着特朗普的言行，更不用说没有墙的欧洲，非洲等地区了。对于这些地方的人民，病毒来自美国来自中国都无所谓。但是特朗普一口一个中国病毒，让病毒来自中国的说法传遍了世界。特朗普把发言稿改成中国病毒，紧接着福奇表示自己不会使用这一说法，到最后特朗普宣布不再使用中国病毒的说法。不管是他们意见真的不统一，还是精心设计的剧本，都太具有戏剧性了，太对媒体的胃口了。如果他说的不是中国，而是A国，我们的官方媒体和自媒体一定会疯狂嘲笑特朗普一番。但是一夜之内，几乎所有上网的人都会知道A国病毒的说法。那么你想一想，国外媒体会放过这种吸引眼球的新闻吗。我们当然想反驳他，但不得不说，和特朗普相比我们的手段太拙劣了。国内民众声音再大，外面听不到。在CGTV抗议，有多少人会看。钟南山、外交部发言人、驻外大使否认这一说法，但这内容关注度本来就很少，只能放在严肃的新闻板块，怎么可能有人气网红特朗普关注度高。更绝的操作是中国驻美大使说病毒来自美国军方，特朗普宣布应该对武汉病毒所进行调查。外交部发言人耿爽回应“他们的敌人是病毒，不是中国”，但这有用吗？病毒来自实验室可是中国大使先提的呀。国外舆论只会认为，你们之前不是说来自美国吗，现在怎么怂了，不敢调查自己？特朗普的语言技巧，舆论掌控能力，真的不是中国媒体可以相比的。中国媒体经常拿特朗普的“假新闻”开玩笑。但这恰恰表明了特朗普很聪明。昨天记者采访被埋儿童家属遭殴打的新闻大家应该都知道。视频里一个女生说：“为了一个采访，至于吗？”遭到网友们潮水般的批评。但如果她换一个说法：“你们新京报就是做假新闻的，我们不能让你们进去，你们只会吃受害者的人血馒头，伤害家属和人民的感情。”这样即使仍然发生了殴打，舆论会截然不同。（当然，这不是一个好事情）天下苦新京报久矣，美国的一些报社其实比新京报更为过分。特朗普经常说假新闻，虽然是转移话题，但这一说法的确迎合美国人民的心意。如何应对记者，特朗普曾经这样说过。面对记者的采访，我通常直言不讳。我一般不会欺骗记者，或者有所保留，因为很多人为此跟媒体结下梁子。当记者向我提尖锐的问题时，我一般只回答这一问题的积极方面，或者是转移话题。比如，记者问我世界第一高楼可能会对西区产生什么不良影响？我会转移话题，告诉他，世界第一高楼属于所有纽约人，他会让纽约因此闻名。如果记者问我，为什么只为富人盖高楼大厦。我会回答，我盖的高楼大厦并不是只让富人收益的，大厦的建设使一大部分施工人员远离了失业的危险，而且每项工程，我都会给政府贡献一笔不菲的税金，特朗普大厦的建成和投入使用为推动纽约发展做出了重要贡献。——《特朗普自传》国内的媒体和营销号平时大事小事带节奏，不断宣传特朗普蠢，没想到这个傻子才是带节奏的高手，轻松引领了国际舆论。现在呢，国外舆论吹捧李文亮医生，污蔑中国数据虚假，说病毒来自中国，挑拨中非关系，试图孤立中国。我们在舆论上太被动了。认定李文亮医生为烈士，修订武汉数据，部分原因是给国外看的，但这些行动根本无法挽回国际舆论，甚至越抹越黑。不过，这些行为在国内还是起了积极的作用。所以美国开始捧方方，因为方方的日记不仅可以在国际上黑中国，还可以破坏中国内部的团结。对于我们国家来说，方方问题很难处理，任何对她的调查打击都会被国外认为政治迫害，也引发国内关于言论自由的不满，但如果不处理，她整天在微博说三道四，很容易误导群众。因此目前只能引导人民群众抵抗方方。国家很难反击，甚至都不能在纽约找到一个同样写封城日记的作家。黑特朗普可以，别小瞧他，在国际舆论的战场上，他打的我们措手不及。,17,4,2020-04-22 15:20:25,2020-04-22 15:20:25
为什么特朗普不关注疫情？不采取措施？,所有网民对特朗普的嘲讽，都默认了一个前提：特朗普是以保护美国人民与振兴美国经济为核心目的。如果，如果这个前提成立，那么特朗普的所作所为称得上愚蠢至极。但是，这个前提只是我们所相信的罢了。它真的成立吗？特朗普的真实目的真是这样的吗？我们不知道。我想起来了一个人，章北海。假设特朗普不愚蠢，那么，他的真实目的是什么？肯定不是网友戏谑的“作为卧底来帮助中国”。难道是为了连任？也不对，如果为了连任的话，很明显积极抗疫会更好。难道真的是因为他目光短浅、愚蠢决策？有可能。但更可能是因为其他原因。那么，这个『其他原因』是什么？我不知道。特朗普，要么是一个连路人的眼光都不如的愚者，要么，是一个我都看不透的伟人。没有第三种情况。所有网民对我国的肯定与赞扬，都默认了一个前提：我国是以保护国民健康为核心目的。如果，如果这个前提成立，那么我国的举措的确称得上正确果断。但是，这个前提只是我们所相信的罢了。它真的成立吗？我国的真实目的真是这样的吗？看看如今其余各国，官民仇恨已经被调动了起来，各国百姓借肯定中国来谴责当地政府，各国政府焦头烂额——对我国来说，这究竟是横空飞来的意外之喜，还是早有预料的定向阳谋？积极救援，究竟是为了帮助民众，还是为了借民众坑杀他国？我不敢断言。如果没有另一件事，那么我其实愿意相信这只是一场偶然。但是，中国做了一件事，让概率的天平倾斜了——那就是，不计前嫌地支援其他各国。常规支援本没有问题，但是，我们的支援是不是有些过度了？如果支援的目的是为了友谊，那么我们不该以这种高强的力度去支援。但如果，支援的目的是获利……恰好，支援真的可以『偶然地』获利。这真的是偶然吗？这令人不寒而栗。中国已经被看透了。虽然具体答案还不确定，但已经是二选一了，而且对两个选项的概率也有了估算。但是，特朗普还未被看透，别说概率估算了，我甚至连候选项都没有。清理老年人口？不对，如果想清理人口的话，那么他还是会在一开始象征性的做一些防疫工作的。借疫情提前引爆不成熟的股灾？嘶，这是一个有魄力的决定，牺牲自己的当下，挽救美国的未来，防止原本未来巅峰期的那一爆直接葬送整个美国。如果是这样，那么他是一个值得敬佩的人，因为他对未来的拯救行为将几乎无一人知晓，三亿人受到他的恩惠，然而没有人会感谢他。愚蠢的短见or寂寞的奉献，这两个选项并不对立统一，它们可以同时为否。那么，第三个选项是什么？如果特朗普不是这两种情况，那么他是怎么想的？头疼，信息不足，难以分析。或许我应该翻翻特朗普前几年的行为？那里面也许有着蛛丝马迹。,67,22,2020-03-25 13:42:44,2020-03-25 13:42:44
如何看待特朗普宣布将极端反法西斯行动组织（ANTIFA）列为恐怖组织？,微博好精彩,1795,256,2020-06-01 05:38:30,2020-06-01 05:38:30
如何看待记者问「为何美国要强调检测比其他国家做得好」，特朗普答「你去问中国」，并称其提问「恶心」？,我发现特朗普才是真正的PUA，技术非常高超，有很多东西值得我们学习。一点都不愚蠢。下面我们来复盘一下这段对话里面的内容，让你学会如何回避指责，甩锅和教训下属。对话1记者：你为啥说自己在检测方面做得很好？不是每天死很多人吗，检测做得再好有啥意义特：全世界每天都在死人（？？？），问中国去，我相信中国会给你一个很不寻常的答复。分析随便解释+甩锅，重点在甩锅上而不在解释上。特朗普完全就没冲着讲道理去，先随便解释一下说死人很正常因为全世界每天都在死人，然后直接开启甩锅模式，把话题引导到另一方面。因为前面有一个解释，会给人一种有理由的感觉，然后快速甩锅，让人没法去细想你的解释到底有没有道理。完美！有的人特别关注这里特朗普说的China和亚裔记者，其实这个并不是重点，只是特本来就喜欢甩锅给中国而已。只要这里的操作手法是先解释，再甩锅就行了，甩给谁并不很重要，只要锅够猛，够吸引注意力就可以。当然甩给中国肯定是目前特的最佳选择，转移矛盾+种族歧视嘛。他不一直这么操作吗？正好记者又是个亚裔，特朗普肯定拿这个做文章。种族歧视都成他的基操了快。适用场景：（因为某件事情）受到指责时。活学活用女朋友：你为啥说自己很关心我？情人节你都不陪我过你：节日可多了去了，每年那么多节日（随便解释一下）。你得问我老板啊，每天给我安排那么多工作，做都做不完。你去问他，他会给你一个很不寻常的答复。当你女友的思路被牵着走，去考虑你老板、工作方面的问题的时候，你就已经达到你的目的了。回到特的回应，是不是后续亚裔女记者就完全忘记了关于检测、疫情、死人这些东西了？疯狂质问特为啥针对自己。这就进入下一步了。对话2记者：你为啥针对我说这些？（你是不是看不起我亚裔？你为啥把我跟中国联系起来？）特：我不是针对你，我是针对任何问这种恶心问题的人。分析假装客观 + 打标签。先否定你对我的指责，假装客观，然后反手给你打个标签，把你当成一个靶子，否定你的价值。你还想否定我PUA？笑话。适用场景：（自己这个人）受到指责时。活学活用同事：我觉得你的工作态度很消极，难以跟你合作你：我不是工作态度消极，我跟不会为人处世的人就是这样打交道的。发现没有，一下子就从你要证明自己没有态度消极变成了你同事要证明自己没有不会为人处世。同样的，回到记者和特朗普，明明是特在乱甩锅，但是特先假装很客观，我没有针对你哦！只是你问了很恶心的问题，错误都在你身上哦。更新一下：有同学问这个对话2怎么回应，对方上来就扣帽子。这种情况首先你要心平气和，你不能生气或者急眼，一生气或者急眼显得你着急了被戳到痛处了，你最好是面带微笑或者像懂王一样面无表情，非常笃定地说。这种对话目的也不是为了说服人，就是单纯的对线的快乐。跟讲理的人千万别这么干，大家心平气和好好讲，但是跟不讲理的人就可以开始对线了。思路是这样的：反扣帽子 + 紧抓对方想回避的点 + 不解释怎么扣呢？拿懂王和记者的例子来说。记者：你为啥针对我说这些？（你是不是看不起我亚裔？你为啥把我跟中国联系起来？）特：我不是针对你，我是针对任何问这种恶心问题的人。记者：是，对你而言任何关心公民健康、人民利益的问题都是恶心问题（直接把帽子扣回去）。我想了解疫情的真相是恶心的问题，我关心人民有没有得到检测也是恶心问题。特：我不想和你说了，你是个恶心的家伙。记者：（无限对线中）是，对你而言关心疫情，为人民发声的人都是恶心的，你心中只有你自己，you nasty ba***rd! 你根本不关心你的祖国！特朗普面无表情，望向遥远的东方。再来个小细节，在对线过程中，怎么让对方有回应感？就是能感觉到你在回应他？你就在你的回应中提到他说的东西就行了，但是你不要真的解释，也不要真的就这个东西展开。比如下面我们给个例子。跟同事对线，扣帽子就完事了。你：我觉得你的工作态度很消极，难以跟你合作同事：我不是工作态度消极，我跟不会为人处世的人就是这样打交道的。你：少扯为人处事的马虎眼（给回应感，但是并不真的就为人处世展开，而且说他扯马虎眼，也是一种帽子），你就是自私自利罢了，领着工资却不想干活。（核心帽子一扣，爽歪歪）同事：我没干活？我xx没做吗？xx项目不是我干的吗？（成功把话题带回到工作态度上）你：你xx做了？你xx做了？我找你过流程你说啥？你说你大侄女要生了，关你啥事？（这是你本来就想怼的东西）同事：你别这么盛气凌人，没有教养的家伙（好家伙，反扣帽子挺熟练）你：我跟你讲工作你跟我扯态度（回应他说的没教养），想自私自利拿钱不干活就明说，别在这拿语气说事当幌子（再扣核心帽子，爽）同事：教养是最基本的，我不跟没教养的人沟通。你：你也就只能可怜地抓住教养说了（假装回应），你敢回应你的自私吗？你敢承认你自己懒惰吗？（扣帽子）同事：我去你的吧（两人开始手上见功夫）学会扣帽子，无限对线不是梦。互怼的时候千万别讲道理，就使命一个接一个帽子扣上去就行了，解释永远是苍白的，扣帽子是最爽的。注意：我这里不是叫大家去怼别人或者给别人扣帽子，我们还是要心平气和讲道理的。只是要知道为啥有时候我们会被别人怼到气得要死，不讲道理的人是啥逻辑。对话3特朗普直接跳过记者2（等待的那个记者），记者2疑惑。记者2：你刚刚叫我了啊？特：下一个，刚刚叫你，但是你没回复，下一个。好的，谢谢大家。分析你敢帮她（记者1）？那你也要受到打压，从而教育这些记者，不要问出我讨厌的问题，并且在被叫到的时候要立即提问。适用场景：下属不听话的时候活学活用办公室里有：你  小王 小张 小李下属小王：我觉得这个方案不应该这样，应该怎样blablabla。你：小张你来谈谈你的想法？小张：...小王：x总，我觉得应该...你：好的，小李你来谈谈。试想一下，如果你是小李，还不赶快谈谈自己想法？特朗普就是这样给记者们造成了一种印象，你们必须得在我叫你们提问的时候马上提问，否则我可以直接跳过你们，或者退场把你们晾在那里。关注特朗普，PUA不迷路。你学废了吗？想了解怎么跟别人抬杠，把别人怼得哑口无言？了解一下反击杠精的必备训练手册↓↓↓想了解更多关于特朗普的知识？看看自传。,19894,651,2020-05-12 13:35:46,2020-06-01 09:12:42
如何客观公正评价特朗普这个人？,在疫情之前我就觉得特朗普的总统做的工作太差了，他根本不懂关税坑了美国中部农民，演讲说的话根本牛头不对马嘴，他等等行为真的让我觉得他是个很差的总统，但是这次疫情这是怎么说呢，这疫情让我看到了他到底有多无能看到了真相这是昨天纽约时报的头版，列出来1000因为疫情而去的人：这样写出来真的让人感到疫情到底拿走了多少人，现在多少有多少家庭伤心欲绝，但特朗普在这期间干啥了？高尔夫。这个昏君tmd在他国人死的时候在tm打高尔夫球，死了10万人没有感到内疚。后来就有个人为了讽刺特朗普的行为作了这张图：哦o对了，今天五月25日是英雄纪念日，全国要为在前线为了保护自由而战死的美国士兵哀悼。就连一般五颜六色的谷歌搜索器也变成了灰色：而特朗普会在这种节日在推特发表个这玩意儿：大写的“纪念日快乐！”？？？？？？？？？？？他以为纪念日是圣诞节吗？脑子有问题吧,92,34,2020-05-26 03:47:43,2020-05-26 03:49:55
2020年特朗普连任的可能性又多大？,可能性非常大就在美国感染人数已接近200万的时候，美国复工了，就是这么不可思议。可特朗普的支持率依然稳定，支持他的人一直在支持，不支持他的人也一直在骂，这个在特朗普当选之初就没有什么变化，即使特朗普被骂做“种zu歧shi者”，他的总统宝座依然稳如老狗。我们不能以国人看待中国的视角去看待美国，屁股歪了，看什么都是错的。疫情既可以让一个国家变得团结，也可以变得分裂，而美国的精英阶层和中下层的分裂已经越来越严重，而疫情加速了分裂进程，而特朗普只要争取中下层即可。美国精英阶层支持在家隔离，而中下层支持复工道理很简单，精英阶层得到更多的医疗资源并拥有更多的储蓄，所以在家隔离是最有利的而中下层没有足够的医疗资源和储蓄保障，在家隔离无异于等死特朗普说：没有人比我更懂疫情他说的没错，对于中下层来说，复工也许还能活，不复工全家都可能会死，大家都不要装小可爱了，谁死谁活，只能践行社会达尔文主义。而特朗普已经利于不败之地，疫情控制住了，他一直支持复工，疫情没控制住，是各州州长的责任.那个拜登在做什么，什么都没有做，骂特朗普、反对特朗普，就像个特朗普的跟屁虫.不管特朗普是对是错，他一直在以中下层的视角去看待和处理问题，虽然现在看起来他在把老百姓往火坑里推，但做总比什么都不做要强，只要顺应民意，即便前面的路九死一生。,34,7,2020-05-13 16:07:35,2020-05-13 16:10:09
